{
  "type": "Offer",
  "inPlace": {
    "identifier": [
       "http://123"
    ],
    "type": "Place",
    "virtualPlace": true,
    "name": [{"lang": "fr","value": "Theatre Verdun"}]
  },
  "isSoldout": false,
  "offerStatus": "EventScheduled",
  "isAccessibleForFree": false,
  "isAccessibleFromAnotherOffer": false,
  "ticketLinkNotAvailable": false,
  "ticketLink": "http://example.com/ticket"
}